{
  "$schema": "https://json-schema.org/draft/2020-12/schema",
  "title": "POST /reallocation",
  "type": "object",
  "properties": {
    "mode": {
      "type": "string"
    },
    "objective": {
      "type": "string"
    },
    "budget": {
      "type": "number"
    },
    "freed_budget_inr": {
      "type": "number"
    },
    "locked_funded": {
      "type": "array",
      "items": {
        "type": "string"
      }
    },
    "stopped": {
      "type": "array",
      "items": {
        "type": "string"
      }
    },
    "remaining_budget_inr": {
      "type": "number"
    },
    "reallocation": {
      "type": "object",
      "properties": {
        "mode": {
          "type": "string"
        },
        "objective": {
          "type": "string"
        },
        "budget": {
          "type": "number"
        },
        "selected": {
          "type": "array",
          "items": {
            "type": "string"
          }
        },
        "total_setup": {
          "type": "number"
        },
        "total_net": {
          "type": "number"
        },
        "budget_left": {
          "type": "number"
        },
        "rejected": {
          "type": "array"
        },
        "ok": {
          "type": "boolean"
        },
        "message": {
          "type": "string"
        }
      },
      "required": [
        "budget",
        "budget_left",
        "message",
        "mode",
        "objective",
        "ok",
        "rejected",
        "selected",
        "total_net",
        "total_setup"
      ]
    },
    "ok": {
      "type": "boolean"
    },
    "message": {
      "type": "string"
    }
  },
  "required": [
    "budget",
    "freed_budget_inr",
    "locked_funded",
    "message",
    "mode",
    "objective",
    "ok",
    "reallocation",
    "remaining_budget_inr",
    "stopped"
  ]
}
